{"configuration_id":"h2epr.0481.comparison.v0.4","configuration_kind":"shared_comparison","configuration_sha256":"98c4a485144f8597b4e1f561b7aeec34e976f0e138b44f52323dfa09bcbf9389","configuration_version":"0.4.0","event_id":"H2EPR-0481","schema_version":"h2epr.scenario-configuration.v3","semantic_parent_ids":["h2epr.0481.roster.v0.4","h2epr.0481.actor-map.v0.4","h2epr.0481.participant-interface.v0.4","h2epr.0481.scenario-interface.v0.4","h2epr.0481.scenario-mechanism.v0.4"],"settings":{"active_actor_ids":["aqsiq","atl","china_consumers","global_consumers","independent_investigators","samsung","samsung_sdi","southwest_airlines"],"assumptions":["Logical coordinates encode a deterministic construction order derived from the fully exposed Draft EPG.","Unspecified magnitudes, beliefs, private deliberation, and alternative actions are not synthesized.","A one-tick route latency is a structural execution choice, not a historical duration estimate.","The practice is an engineering baseline and is not eligible for held-out or scientific claims."],"communication_routes":[{"latency_ticks":1,"route_id":"route.aqsiq.to.samsung","source_id":"aqsiq","target_id":"samsung"},{"latency_ticks":1,"route_id":"route.atl.to.samsung","source_id":"atl","target_id":"samsung"},{"latency_ticks":1,"route_id":"route.china_consumers.to.samsung","source_id":"china_consumers","target_id":"samsung"},{"latency_ticks":1,"route_id":"route.global_consumers.to.samsung","source_id":"global_consumers","target_id":"samsung"},{"latency_ticks":1,"route_id":"route.independent_investigators.to.samsung","source_id":"independent_investigators","target_id":"samsung"},{"latency_ticks":1,"route_id":"route.samsung.to.china_consumers","source_id":"samsung","target_id":"china_consumers"},{"latency_ticks":1,"route_id":"route.samsung.to.independent_investigators","source_id":"samsung","target_id":"independent_investigators"},{"latency_ticks":1,"route_id":"route.southwest_airlines.to.samsung","source_id":"southwest_airlines","target_id":"samsung"}],"exposure_mode":"full_draft_exposed","initial_state":{"entities":{"battery_supply":{"domestic_supplier":"none","initial_supplier":"none"},"cause_report":{"status":"unpublished"},"china_incidents":{"report_status":"absent"},"china_regulation":{"test_unit_requirement":"absent"},"corporate_position":{"china_claim":"neutral"},"corporate_response":{"shipment_status":"active","testing_status":"not_started"},"flight_incident":{"report_status":"absent"},"global_incidents":{"report_status":"absent"},"investigation":{"status":"not_started"},"litigation":{"status":"absent"},"product":{"launch_status":"not_launched"},"production":{"status":"active"},"recall":{"china_scope":"none","global_scope":"none"},"sales":{"global_status":"not_started"},"supplier_position":{"atl_battery_link":"unaddressed"}},"state_version":0},"observation_contract":{"message_delivery_phase":"before_decision_collection","same_coordinate_write_visibility":"forbidden","schema_version":"h2epr.participant-observation.v2","sealed_prestate_per_coordinate":true},"purpose":"Dataset-only deterministic Rule construction practice on the shared Rule/LLM/RuleLLM comparison surface.","termination":{"require_all_ticks":true,"require_no_unresolved_messages":true},"timeline":[{"coordinate_id":"note7.c01","episode_id":"E1","label":"global launch","logical_tick":1,"source_time":"2016-08-02/23","stage_id":"S1"},{"coordinate_id":"note7.c02","episode_id":"E1","label":"sales and initial supply","logical_tick":2,"source_time":"2016-08-19/23","stage_id":"S1"},{"coordinate_id":"note7.c03","episode_id":"E2","label":"initial incident reports","logical_tick":3,"source_time":"2016-08-24/2016-09-01","stage_id":"S1"},{"coordinate_id":"note7.c04","episode_id":"E2","label":"testing and shipment delay","logical_tick":4,"source_time":"2016-08-24/2016-09-01","stage_id":"S1"},{"coordinate_id":"note7.c05","episode_id":"E3","label":"partial global recall","logical_tick":5,"source_time":"2016-09-02/13","stage_id":"S2"},{"coordinate_id":"note7.c06","episode_id":"E4","label":"China test-unit requirement","logical_tick":6,"source_time":"2016-09-14/17","stage_id":"S2"},{"coordinate_id":"note7.c07","episode_id":"E4","label":"China test-unit recall","logical_tick":7,"source_time":"2016-09-14/17","stage_id":"S2"},{"coordinate_id":"note7.c08","episode_id":"E5","label":"domestic battery supply","logical_tick":8,"source_time":"2016-09-18/30","stage_id":"S2"},{"coordinate_id":"note7.c09","episode_id":"E5","label":"China incidents and supplier denial","logical_tick":9,"source_time":"2016-09-18/30","stage_id":"S2"},{"coordinate_id":"note7.c10","episode_id":"E5","label":"external-heating claim","logical_tick":10,"source_time":"2016-09-18/30","stage_id":"S2"},{"coordinate_id":"note7.c11","episode_id":"E5","label":"China-market apology","logical_tick":11,"source_time":"2016-09-18/30","stage_id":"S2"},{"coordinate_id":"note7.c12","episode_id":"E6","label":"flight fire report","logical_tick":12,"source_time":"2016-10-01/10","stage_id":"S3"},{"coordinate_id":"note7.c13","episode_id":"E6","label":"production suspension","logical_tick":13,"source_time":"2016-10-01/10","stage_id":"S3"},{"coordinate_id":"note7.c14","episode_id":"E7","label":"production and sales termination","logical_tick":14,"source_time":"2016-10-11/31","stage_id":"S3"},{"coordinate_id":"note7.c15","episode_id":"E8","label":"consumer litigation","logical_tick":15,"source_time":"2016-11-01/2017-01-22","stage_id":"S4"},{"coordinate_id":"note7.c16","episode_id":"E8","label":"internal investigation","logical_tick":16,"source_time":"2016-11-01/2017-01-22","stage_id":"S4"},{"coordinate_id":"note7.c17","episode_id":"E8","label":"independent findings","logical_tick":17,"source_time":"2016-11-01/2017-01-22","stage_id":"S4"},{"coordinate_id":"note7.c18","episode_id":"E9","label":"cause report publication","logical_tick":18,"source_time":"2017-01-23","stage_id":"S4"},{"coordinate_id":"note7.c19","episode_id":"E9","label":"terminal delivery barrier","logical_tick":19,"source_time":"post-publication","stage_id":"S4"}]},"value_provenance":[{"basis":"Roster dispositions with an explicit action-bearing boundary.","classification":"dataset_derived","json_pointer":"/settings/active_actor_ids"},{"basis":"Explicit construction and claim-boundary assumptions.","classification":"structural","json_pointer":"/settings/assumptions"},{"basis":"Minimal routes required by published message rows, each with one-tick latency.","classification":"structural","json_pointer":"/settings/communication_routes"},{"basis":"Exact exposure mode pinned by the Source Profile.","classification":"dataset_derived","json_pointer":"/settings/exposure_mode"},{"basis":"Neutral typed pre-event values required by the declared mechanism.","classification":"structural","json_pointer":"/settings/initial_state"},{"basis":"Shared sealed-prestate and delivery-phase contract.","classification":"structural","json_pointer":"/settings/observation_contract"},{"basis":"Declared backend-neutral benchmark comparison purpose.","classification":"structural","json_pointer":"/settings/purpose"},{"basis":"Shared benchmark runtime closure contract.","classification":"structural","json_pointer":"/settings/termination"},{"basis":"Ordered construction coordinates mapped to exposed Draft stage and episode identifiers.","classification":"dataset_derived","json_pointer":"/settings/timeline"}]}
